{
  "verdict": "approve",
  "summary": "F1 安全边界完整、无破裂：getGroupBySlug 仅在 portal 服务层使用（未进 queries.ts 公共层），client.createKey 收到的是 group.newapiGroup（非 slug/内部 id），binding.groupId 写的是内部 group.id，且 result.binding 经 toPublicApiKey 严格 9 字段白名单投影、已剔除 groupId/newapiGroup。拒绝分支（组不存在/status≠active/allowCreateKey≠true）在调用 client 之前触发、无远端副作用；建 Key 不再限定模型（allowedModels='[]'，client 不传 allowedModels），符合 Q3。route.ts POST 未新增 emailVerified 校验（F19）。测试质量高：create-portal-key.test 覆盖正常路径（group===newapiGroup、binding.groupId===内部 id、序列化 JSON 不含 newapiGroup/内部 id）与三种拒绝路径（disabled/locked/missing 均抛错且 client.createKey 未被调用）；key-input.test 覆盖 groupSlug 缺失/空白→报错。本人复跑：目标 4 文件 45 pass/0 fail，全量 143 pass/0 fail，与 Orchestrator 一致。仅有 2 条非阻断观察：route.ts 的 groupId/newapiGroup 解构属冗余防御（真正保障在 toPublicApiKey），以及 smoke-mvp.ts 仍按旧签名传 allowedModels（已知留 Step 16）。",
  "findings": [
    {
      "id": "R1-F1",
      "severity": "minor",
      "category": "maintainability",
      "title": "route.ts 剔除内部字段属冗余",
      "detail": "route.ts:47-48 对 result.binding 解构剔除 groupId/newapiGroup（{ groupId, newapiGroup, ...key }），但 createPortalApiKey 返回的 result.binding 已是 toPublicApiKey(created) 的产物——该投影是 portal.ts:148-160 的严格白名单，只含 id/keyMasked/displayName/status/allowedModels/createdAt/updatedAt/lastUsedAt/deletedAt 九个字段，根本不含 groupId/newapiGroup。因此该解构剔除的是不存在的属性，是 no-op。真正杜绝内部 id/newapiGroup 下发的保障在 toPublicApiKey（GET/list 路径 portal.ts:600/663/742 复用同一投影，也因此安全）。这不构成泄漏风险（边界其实是闭合的），但 route 层的剔除会给读者造成『安全靠这里兜底』的误解，且若日后有人误改 toPublicApiKey 把 groupId 放进白名单，仅 POST 路径被 route 解构挡住、GET/list 路径会直接泄漏，防护点不统一。建议（非必须）：要么去掉 route.ts 的冗余解构、把『不暴露内部 id』的注释与守护集中在 toPublicApiKey；要么补一条针对 toPublicApiKey 投影的断言（断言其 key 集合不含 groupId/newapiGroup），让边界保障单点化、可回归。",
      "anchor": "src/app/api/apipool/keys/route.ts:47-48 与 src/features/newapi-bridge/server/portal.ts:148-160",
      "confidence": 0.9,
      "recommendation": "去掉 route.ts 冗余解构并把内部字段守护集中到 toPublicApiKey（或补一条对 toPublicApiKey 投影字段集的断言），使 POST/GET/list 三路径共用同一单点防护。非阻断。"
    },
    {
      "id": "R1-F2",
      "severity": "minor",
      "category": "scope",
      "title": "smoke-mvp 旧签名未跟随",
      "detail": "scripts/smoke-mvp.ts:257-260 仍以旧签名调用 createPortalApiKey(user, { name, allowedModels: [model] })，与本 step 变更后的 PortalKeyCreateInput（portal.ts:41-46，必填 groupSlug、已移除 allowedModels）类型不兼容，属编译期破坏。任务已明确『smoke-mvp 留 Step 16』，故这是预期内的延迟项、不算 Step 7 回归；且测试套件不执行 smoke-mvp，故未在 143 全绿中暴露。仅作记录，避免在 Step 16 被遗漏。",
      "anchor": "scripts/smoke-mvp.ts:257-260",
      "confidence": 0.9,
      "recommendation": "无需在本 step 处理；在 Step 16 改 smoke-mvp 时把入参从 allowedModels 改为 groupSlug（指向 seed 的 official 等可建 Key 分组）。"
    }
  ],
  "prior_findings_status": [],
  "open_questions": []
}