{"verdict":"approve","summary":"ship：第 1 轮 blocker/major 已实质修复，未发现阻止冻结进入开发的新 major/blocker 回归。","findings":[],"prior_findings_status":[{"id":"F1","status":"resolved","evidence":"DESIGN.md D5/§6.2/§6.3 明确浏览器与 POST 只使用 groupSlug，getGroupsForKeyCreation 仅返回 slug/name/userDescription，不含内部 id/newapiGroup；§5.4 与 §10.1 F9 补齐未知 slug、disabled、allowCreateKey=false 拒绝路径及不暴露内部映射的测试要求。review-log F1 标记采纳并列出同样落点。"},{"id":"F2","status":"resolved","evidence":"DESIGN.md §3.2 已把 amountUsd 修正为美元数值整数，且与真实 order 表字段 orderNo/status/paymentProvider/paidAt 对齐；§5.8/§6.2 新增 listBillingLedgerEntries(portalUserId) 独立投影 join order，不改 toPublicLedgerEntry；§10.1 F21 明确 amountUsd=5 显示 $5.00 且不 ×100。"},{"id":"F3","status":"resolved","evidence":"DESIGN.md D6、§0.4、§9.2、§11 Q-A 均把 catalog 表 sqlite-only 标为已定稿，confirmed-requirements.md §6 同步落定；§5.1/§10.1 F1 规划 catalog-schema-singlesource.test.ts，断言 pg/mysql 源码不含 catalog_ 表名且 barrel 可解析 7 个 catalog export。"},{"id":"F4","status":"resolved","evidence":"DESIGN.md §10 原则不再接受仅人工走查；§10.1 F9/F11/F13/F20/F21 和 §10.3 为建 Key 选分组、设置页保存、充值状态列、余额不足提示、/models 筛选分别指定 node:test 服务/投影/组件契约断言，并要求扩展 smoke:mvp 覆盖 groupSlug 建 Key到真实调用到用量闭环；人工走查被降为视觉补充。"},{"id":"F5","status":"resolved","evidence":"DESIGN.md D9/§5.1/§7.2/§8.2 明确 init-catalog 使用 insert ... onConflictDoNothing 加事务，不复制 init-rbac 的先查后插；§6.1 给出 slug unique、modelId unique、(modelId, capabilityId) unique、(modelId, groupId) unique 等 onConflict 依赖约束；§10.1 F1 增加连跑与 Promise.all 并发可重入断言。"}],"open_questions":["Q-B：/models 是否保留独立 Deals 视觉分区，还是完全用分组 + discountNote/划线价表达折扣。","Q-D：是否需要分组到 New API group 的最小连通性自检；当前设计倾向不做，靠建 Key 失败态暴露。","Q-E：历史无分组 Key 的展示文案采用“—”还是“默认”，以及是否提示用户重建带分组 Key。"]}