{
  "verdict": "approve",
  "summary": "Step 12 正确把 settings/[tab]/page.tsx 的 redirect 桩换成真实设置页：requirePermission(SETTINGS_READ) → getSettingTabs(tab) + getSettings() 按 s.tab===tab 过滤 → 映射为 FormField → FormCard → 'use server' saveConfigs，auth/email 两 tab 可用。两个重点关切均经实证排除：(1) password 安全——页面对 password 字段强制 value:''（page.tsx:102），Form 的 defaultValues 取 field.value||''（index.tsx:251），Input 渲染 value={formField.value}（input.tsx:17），明文 password 不进入任何渲染 value，仅以占位文案提示『已配置』，无明文泄漏；auth/email 的非 password 字段（client_id、switch、sender_email）均非 §3.5 敏感项，回填 getAllConfigs 合规。(2) F20 空值不覆盖——纯函数 collectNonEmptyConfigs 跳过空/纯空白字符串字段，handler 再 guard length>0 才 saveConfigs，避免清除已存密钥/破坏 env>db 优先级，并有专项单测覆盖空串+纯空白+白名单外键。tab 非法走 notFound()，handler 返回 {status,redirect_url} 停留当前 tab。改动仅 7 文件（page + sidebar en/zh + settings en/zh + 2 测试），未触碰 settings.ts/config.ts/Better Auth/Resend，符合 §D8 零核心重写。i18n en/zh 键集一致且新增 configured_password 占位双语齐备。测试为真实 libsql 库跑 saveConfigs→getAllConfigs 回读、tab 过滤断言字段集、空值剔除纯函数、页面结构守护（删 redirect 桩 + 含 SETTINGS_READ/getSettings/getAllConfigs/saveConfigs/FormCard/collectNonEmptyConfigs），无假绿。仅一条 minor 防御纵深建议（Server Action 未二次校验权限），非本 step 阻塞项。",
  "findings": [
    {
      "id": "S12-1",
      "severity": "minor",
      "category": "security",
      "title": "保存 Server Action 未二次鉴权",
      "detail": "页面仅在 RSC 渲染处 requirePermission(SETTINGS_READ)（page.tsx:64-68），但 submit.handler（'use server'，page.tsx:121-134）内部直接 collectNonEmptyConfigs + saveConfigs，无任何权限/会话校验。Next.js Server Action 编译为可独立调用的 POST 端点，其可达性不随页面渲染门控而消失；理论上具备该 action 引用、仅有 SETTINGS_READ（甚至无写权限）的调用方可触发设置写入，构成防御纵深缺口。当前实际风险中等（路由在 admin 组、action 闭包绑定、生产单实例），且 DESIGN §5.7 仅要求 requirePermission(SETTINGS read)、未强制写门控，故不作阻塞。注明：本条为加固建议，非本 step 必须。",
      "anchor": "src/app/[locale]/(admin)/admin/settings/[tab]/page.tsx:121-134",
      "confidence": 0.6,
      "recommendation": "在 'use server' handler 首行补一次服务端鉴权（如 requirePermission({ code: PERMISSIONS.SETTINGS_WRITE }) 或至少 SETTINGS_READ），使写操作不依赖页面渲染门控；可在本 step 顺手补，或留待 F16/F17/F18 接续 step 统一加固并在 dev-log 记录。"
    },
    {
      "id": "S12-2",
      "severity": "minor",
      "category": "maintainability",
      "title": "未知类型静默降级为 text",
      "detail": "toFormFieldType（page.tsx:33-37）对不在 supportedFormFieldTypes 白名单的 Setting.type 一律降级为 'text'。当前 auth/email 全部字段类型（text/password/switch）均在白名单内，无现实风险。但若未来在 settings.ts 新增一个承载敏感值、类型名拼写不一致或自定义的字段（例如某 *_secret 用了非 'password' 的类型），会被静默渲染成普通 text 输入并因非 password 分支回填明文 value（page.tsx:102 的三元仅对 type==='password' 留空），存在潜在回归面。注明：非必须，属前瞻性加固。",
      "anchor": "src/app/[locale]/(admin)/admin/settings/[tab]/page.tsx:33-37",
      "confidence": 0.45,
      "recommendation": "可选：对未知类型在开发期 warn，或把『敏感字段判定』从 type==='password' 收窄为基于字段名/显式 secret 标记（与 §3.5 publicSettingNames 对齐），避免未来新增非 password 类型的密钥字段被明文回填。无需本 step 处理。"
    }
  ],
  "prior_findings_status": [],
  "open_questions": [
    "本 step 仅接回页面渲染与保存，OAuth/Resend 端到端生效（F16/F17/F18）依赖后续 step 真实填密钥并验证 Better Auth 动态装载——已在 DESIGN §10.1 F20→F16/17/18 标注为接续，不属本 step 范围。",
    "Server Action 写鉴权（S12-1）是否在本 step 补、还是留到设置相关接续 step 统一加固，建议由 Orchestrator 拍板。"
  ]
}
