{"verdict":"needs-revision","summary":"no-ship：设计里仍有 schema 方言决策未定、Key 分组 API 自相矛盾、支付展示数据源与金额单位不一致，以及核心 UI 验证不可重复，不能进入开发。","findings":[{"id":"F1","severity":"major","category":"data-api-stateflow","title":"建 Key 分组输入在 public slug 与内部 groupId 之间断裂","detail":"设计一方面把 `catalog_group.id` 作为内部 PK，并要求 `newApiKeyBinding.groupId` FK 到该内部 id；另一方面公共查询 `getGroupsForKeyCreation()` 只返回 `{ slug; name; userDescription }`，不返回 id，且 confirmed 明确禁止向普通用户暴露内部 ID。这样实现时只有两条路：把内部 `catalog_group.id` 送到浏览器/POST 请求，违反边界；或者让浏览器提交 slug 给名为 `groupId` 的字段，导致服务端 FK 落库和 `getGroupNewapiMapping(groupId)` 语义不匹配。影响是 U6 建 Key 选分组要么不可实现，要么以暴露内部 ID 的方式实现，后续历史 Key 展示和分组删除也会持续混乱。","anchor":"docs/design/user-mvp/DESIGN.md:411-417; docs/design/user-mvp/DESIGN.md:467-529; docs/design/user-mvp/.codex/confirmed-requirements.md:36","confidence":0.9,"recommendation":"把用户输入字段明确改为 `groupSlug` 或更面向用户的 `channelSlug`；`getGroupsForKeyCreation()` 返回 slug/name/description；`POST /api/apipool/keys` 只接收 slug，服务端在同一事务/流程内解析到内部 `catalog_group.id` 与 `newapiGroup`，只把内部 id 写入 `newApiKeyBinding.groupId`。补单元/集成测试：响应 payload 不含 `id/newapiGroup`，未知 slug/disabled/allowCreateKey=false 均拒绝。"},{"id":"F2","severity":"major","category":"codebase-consistency","title":"充值记录设计没有可用的支付状态数据源，且误写了 amountUsd 单位","detail":"设计说 billing 页“无新接口”只扩展现有 ledger 取数，并展示 `payStatus = 关联 order 状态`；但当前 billing 只调用 `listLedgerEntries(user.id)`，而 `toPublicLedgerEntry()` 返回 id/amount/source/status/reason/rollbackStatus/createdAt，不返回 `orderNo`，因此页面无法关联 `order.status`。同一段设计还把 `amountUsd` 标成“美分”，但真实代码 `toAmountUsd(amountCents)` 会除以 100 后写入 ledger，测试明确断言 500 cents 存为 `amountUsd=5`，`formatUsdAmount()`也按美元数直接格式化。照设计实现会让 A7/U4 的支付状态列没有数据来源，或把金额显示成 100 倍错误。","anchor":"docs/design/user-mvp/DESIGN.md:138; docs/design/user-mvp/DESIGN.md:550-556; src/features/newapi-bridge/server/portal.ts:162-170; src/app/[locale]/(landing)/dashboard/billing/page.tsx:40-47; src/features/newapi-bridge/server/recharge.ts:51-52; tests/payments/recharge.test.ts:95-100","confidence":0.94,"recommendation":"设计里新增明确的只读投影，例如 `listBillingLedgerEntries(portalUserId)`，返回 `ledger.orderNo`、`order.status/paymentProvider/paidAt`、`ledger.status`、`amountUsd`；实现可在 portal/payment service 层 join `order` 表或批量查 order。同步修正文档：`amountUsd` 当前是美元金额数字，不是美分；若要改成美分需另列迁移方案和全链路测试。"},{"id":"F3","severity":"blocker","category":"compat-migration","title":"D6 把硬性三方言约束留成未决问题，数据库方案未定稿","detail":"confirmed 明确要求 drizzle sqlite/postgres/mysql schema 不得漂移，并写明“类型推导要在三方言编译”。设计 D6 却决定 catalog 表只写 `schema.sqlite.ts`，并在 Q-A 里要求评审确认这个解释是否成立。当前代码确实 `schema.ts` 只 export sqlite，pg/mysql 也缺 bridge 表，但这只能说明现状有历史边界，不能替代本轮对 7 张新表的迁移决策。若进入开发后才改口补三方言，DDL、类型、测试和 migrator 都会返工；若坚持 sqlite-only，也需要把 confirmed 的硬约束正式改写成可执行的方言策略。","anchor":"docs/design/user-mvp/.codex/confirmed-requirements.md:51-52; docs/design/user-mvp/DESIGN.md:259-265; docs/design/user-mvp/DESIGN.md:289-292; docs/design/user-mvp/DESIGN.md:730; src/config/db/schema.ts:1-5","confidence":0.86,"recommendation":"编码前必须二选一并写入设计：A. catalog 表只支持 sqlite/libsql，明确 pg/mysql schema 不在 user-mvp 支持面，并新增类型/构建守护证明运行时只从 sqlite barrel 推导；B. 在 `schema.postgres.ts` 与 `schema.mysql.ts` 补齐等价 catalog 表和类型测试。不要把 Q-A 留到开发中解决。"},{"id":"F4","severity":"major","category":"testing","title":"核心 UI 流程只规划人工走查，缺少可重复断言","detail":"第 10 节声明每个功能点有单元/功能/UI 三层验证，但 §10.3 又说 UI 交互主要靠 Preview/Chrome MCP 手动核验，关键流“至少各一次人工走查”。仓库当前 `package.json` 只有 `tsx --test tests/**/*.test.ts`，没有 Playwright/Cypress/Vitest browser 配置。建 Key 分组下拉、设置页保存 OAuth/Resend、充值记录状态列、余额不足提示这些都是用户可见关键流，只有人工点击记录无法作为 CI 或回归断言，后续重构 FormCard/TableCard 或 API payload 时会静默坏掉。","anchor":"docs/design/user-mvp/DESIGN.md:671-721; package.json:14-20","confidence":0.88,"recommendation":"把 UI 层验证改成可执行计划：要么引入 Playwright 并列出至少 3 条 e2e/spec（建 Key 选分组并提交、settings auth/email 保存、billing 充值状态展示），要么在现有 node:test 下补页面源码/组件行为守护但明确哪些交互仍需手测。关键流不能只写“人工走查”，每条验收至少要有可运行命令和断言。"},{"id":"F5","severity":"major","category":"data-api-stateflow","title":"seed 并发安全声明不成立，先查后插会在并发部署下抛唯一冲突","detail":"设计把 `init-catalog` 写成仿 `init-rbac.ts` 的“先查后插”，并在性能/并发章节宣称该 seed 幂等且并发安全。真实 `init-rbac.ts` 的模式是在插入前 select，没用 `onConflictDoNothing` 或捕获唯一冲突；两个进程同时 seed 同一个 slug 时都可能查不到，然后其中一个 insert 失败。catalog seed 是迁硬编码到 DB 的地基，F1 验收还要求 seed 中途失败可重入；如果部署脚本、手工重跑和回滚窗口重叠，初始化可能直接失败，导致 `/models` 空目录或建 Key 无分组。","anchor":"docs/design/user-mvp/DESIGN.md:291; docs/design/user-mvp/DESIGN.md:635; scripts/init-rbac.ts:358-375","confidence":0.82,"recommendation":"不要复制 `init-rbac` 的并发脆弱模式。设计改为每个 seed 表按 slug 使用 `insert ... onConflictDoNothing/onConflictDoUpdate`，或在唯一冲突时重新 select 并继续；多表 seed 放进事务并保证可重入。测试矩阵 F1 增加并发用例：`Promise.all([initCatalog(), initCatalog()])` 后行数稳定且不抛错。"}],"prior_findings_status":[],"open_questions":["Q-A 必须由 Author/Owner 明确：catalog 表到底 sqlite-only，还是补齐 postgres/mysql 三方言？","公共 API 的用户可见字段是否同意统一为 `groupSlug/channelSlug`，内部 `groupId` 只在服务端保存？"]}