{
  "verdict": "approve",
  "summary": "OQ-2 安全加固落地正确：14 个 admin catalog/settings 的 'use server' submit handler 均在首行（'use server' 后第一条语句、blank line 仅为空白）补 `await requirePermission(WRITE)`，位于任何 createX/updateX/setX/saveConfigs 写操作之前，能有效阻断 Next.js Server Action 直接 POST 绕过页首门控。权限码分配正确（13 catalog 用 CATALOG_WRITE、settings 用 SETTINGS_WRITE）；handler 内调用不传 redirectUrl，失败 throw PermissionDeniedError，被 FormCard onSubmit 的 catch 捕获并 toast.error，语义正确（server action 内不触发不当 redirect）。页首 requirePermission 双层门控全部保留未删；除补鉴权外字段/写函数/revalidate/返回值未变。守护测试 admin-write-authz.test.ts 用锚定到 'use server' 的正则校验 handler 段含 WRITE 鉴权且断言调用数 >=2，无法被页首调用假绿。范围覆盖完整：grep 确认 catalog+settings 下恰好 14 个 'use server' 文件全部命中，users/[id]/detail 确为只读无写 handler。仅 1 条 minor 范围观察（roles/users edit 写 handler 未做二次校验，但属本 step 范围外、且为 DESIGN 引用的既有基线模式），不阻断。",
  "findings": [
    {
      "id": "F1",
      "severity": "minor",
      "category": "scope",
      "title": "roles/users 写 handler 仍无二次校验",
      "detail": "审查范围外的 4 个既有 admin 写 handler 未做 'use server' 内二次鉴权，仅有 passby null-check（`if (!role/user) throw new Error('no auth')`，并非权限校验）：src/app/[locale]/(admin)/admin/roles/[id]/edit/page.tsx:70-76、roles/[id]/edit-permissions/page.tsx:90-96、users/[id]/edit/page.tsx:69-75、users/[id]/edit-roles/page.tsx:87-93。它们同属 Server Action 独立 POST 端点，理论上存在与 catalog/settings 相同的绕过页首门控风险（页首仍有 ROLES_WRITE/USERS_WRITE 门控，但 handler 段未二次校验）。但这超出本 step（OQ-2）明确定义的 14 文件 catalog/settings 范围；且 DESIGN §8.1（DESIGN.md:665）把二次校验要求显式限定在 `/admin/catalog/*`、`/admin/settings/*`，并以『仿 roles edit passby 校验』作为既有参照模式——即 roles edit 的 passby-only 写法是本 step 之前就存在的基线，非本次回归引入。故不影响本 step 验收。",
      "anchor": "src/app/[locale]/(admin)/admin/roles/[id]/edit/page.tsx:70-76",
      "confidence": 0.85,
      "recommendation": "非本 step 必须项，仅建议：另开 follow-up（或扩展 OQ-2 范围）为 roles/users 4 个写 handler 补 `await requirePermission(ROLES_WRITE/USERS_WRITE)`，并将 admin-write-authz.test.ts 的 targets 扩展覆盖，使二次校验在整个 admin 写面闭环。本轮不阻断。"
    }
  ],
  "prior_findings_status": [],
  "open_questions": [
    "OQ-2 的设计意图是否仅限 catalog/settings（与 DESIGN §8.1 措辞一致），还是后续计划把 roles/users 写 handler 一并纳入二次校验？若属后者，建议在 dev-log 记一条 follow-up 以免遗漏（仅澄清，不阻断本 step）。"
  ]
}
