{
  "verdict": "approve",
  "summary": "Step 16 将 scripts/smoke-mvp.ts 建 Key 调用改为 createPortalApiKey(user, {name, groupSlug:'official'})，移除了已废弃的 allowedModels，精确适配 Step 7 的 PortalKeyCreateInput 签名（portal.ts:43-48）。created.binding.id / created.plainKey / binding.keyMasked 取用均与返回形状（portal.ts:535-538）一致，且与生产路由 keys/route.ts 的用法镜像。/v1 调用所用 model 来自 resolveSmokeLaunchModel，与建 Key 入参解耦、未被破坏；quota 调整、用量可见、禁用 401 等闭环逻辑均未触碰。无 live env 时 finishSkipped 优雅 SKIPPED（退出码 0），APIPOOL_SMOKE_REQUIRE_LIVE=true 时才抛错，逻辑保持。'official' 为真实 seed slug（init-catalog.ts:65）。新增注释合理标注 live 运行需手动对齐 newapiGroup（符合 DESIGN §9.1/§11 外部依赖），未伪称端到端已验证。diff 仅 smoke-mvp.ts（3 增 1 删），scope 干净。验证结果（SKIPPED 退出码 0、177 pass、tsc 无新错）与本 step 范围一致，故批准。",
  "findings": [
    {
      "id": "S16-1",
      "severity": "minor",
      "category": "maintainability",
      "title": "默认组 newapiGroup 为空的对齐语义可更明确",
      "detail": "seed 中 official 分组 newapiGroup='' (init-catalog.ts:65-72)，即映射到 New API 默认分组。新增注释（smoke-mvp.ts:257-258）说『live New API smoke must align that group's newapiGroup with the external New API group』，方向正确且与 DESIGN §9.1（管理员手动对齐 newapiGroup）一致；但当前默认值为空字符串时，对齐是隐式的（= New API 默认 group，等价现状退路，见 DESIGN §6.1/§5.1 D5）。可选地在注释补一句『若烟测环境用非默认 group，需把 official 的 newapiGroup 改为对应值』，让读者无需回查 DESIGN 即知边界。非必须——当前注释已足够准确，不影响正确性或 SKIPPED 就绪，仅为可读性增益。",
      "anchor": "scripts/smoke-mvp.ts:257-262",
      "confidence": 0.55,
      "recommendation": "可选：在 live 对齐注释末尾补一句非默认 group 场景需改 newapiGroup 的提示；或保持现状（已符合 DESIGN，不阻塞）。"
    }
  ],
  "prior_findings_status": [],
  "open_questions": [
    "端到端 live 运行依赖真实 New API 烟测环境（本地不可达），本轮仅复核代码适配 + SKIPPED 就绪；live 200 / 余额↓ / 禁用 401 的实际跑通留用户在 confirmed §0.2 环境验证（符合 DESIGN §9.1/§11，不计入本 step 缺陷）。"
  ]
}
